{
  "schema_version": "1.0",
  "id": "kv.lore.region.border_lands",
  "type": "lore_chunk",
  "title": "Пограничные земли (обзор для RAG)",
  "source": { "book": "kv_core", "edition": "TBD-by-Ivan", "pages": [1] },
  "verified": false,
  "locale": "ru",
  "terminology": "pandora_box",
  "notes": "DRAFT-ШАБЛОН (LT1). Текст — ПЛЕЙСХОЛДЕР: Иван пересказывает оригинальной прозой из лицензированной книги TOR2e (раздел о Пограничных землях / карта Эриадора), 300-600 ток., сверяет против своей книги; НЕ дословно, НЕ из легендариума. Проставить source.edition + pages (kv_core: КОНКРЕТНЫЕ страницы региона, которые пересказываешь — структурно энфорсит retell цитируемой страницы). verified:false -> вне живого пака.",
  "payload": {
    "chunk_id": "region.border_lands",
    "region": "border_lands",
    "kind": "region",
    "text": "[DRAFT — пересказать из книги TOR2e (Пограничные земли / тип местности border): где, чем живут, на что похожа дорога; конкретика быта и природы для опоры Хранителя. Заполнить оригинальной прозой 300-600 ток. под анти-слоп гейт + VK_ADDENDUM.]"
  }
}
