{
  "schema_version": "1.0",
  "id": "kv.lore.region.dark_lands",
  "type": "lore_chunk",
  "title": "Тёмные земли (обзор для RAG)",
  "source": { "book": "kv_core", "edition": "TBD-by-Ivan", "pages": [1] },
  "verified": false,
  "locale": "ru",
  "terminology": "pandora_box",
  "notes": "DRAFT-ШАБЛОН (LT1). Текст — ПЛЕЙСХОЛДЕР: пересказ оригинальной прозой из книги TOR2e (Тёмные земли / тип местности dark), 300-600 ток., сверка против книги Ивана; НЕ дословно, НЕ из легендариума. ОСТОРОЖНО с пастишем — это самый слоп-рискованный регион (стоп-лист пака применяется строго). Проставить source.edition + pages (kv_core: КОНКРЕТНЫЕ страницы региона, которые пересказываешь).",
  "payload": {
    "chunk_id": "region.dark_lands",
    "region": "dark_lands",
    "kind": "region",
    "text": "[DRAFT — пересказать из книги TOR2e (Тёмные земли / тип местности dark): чем гнетёт, конкретные признаки запустения; БЕЗ «древнее зло пробуждается» и пр. пастиша. Оригинальная проза 300-600 ток. под гейт + VK_ADDENDUM.]"
  }
}
